{
  "schema_version": "isaac-pedregal-manual-capture-v0.1",
  "source": {
    "institution": "SENAMHI",
    "platform": "ISAAC",
    "report_url": "https://bit.ly/ISAAC_SENAMHI",
    "report_page": null,
    "visual_title": "Datos históricos de precipitación horaria"
  },
  "station": {
    "displayed_name": "Pedregal Koica",
    "displayed_code": "16",
    "selected": true,
    "selection_evidence": {
      "source": "VISIBLE_FILTER",
      "detail": "La fila ID 16 Pedregal Koica es visible en la tabla y la estación aparece resaltada en el mapa; la barra de direcciones app.powerbi.com también es visible."
    },
    "station_status": "Normal",
    "operational_status": "Operativo"
  },
  "filters": {
    "station": "Pedregal Koica",
    "temporal_selector": "deslizador temporal visible",
    "start_date": null,
    "end_date": null,
    "other_filters": null
  },
  "export": {
    "checked": false,
    "available": null,
    "check_method": null
  },
  "scientific_use": {
    "rainfall_candidate": false,
    "scientific_observation_accepted": false,
    "outcome_label": null,
    "automatic_outcome_classification": false,
    "automatic_bias_correction": false,
    "bias_correction_applied": false,
    "threshold_changes": false,
    "production_use": false,
    "production_ready": false,
    "operational_alerting_enabled": false,
    "missing_data_rule": "UNKNOWN_NOT_ZERO"
  },
  "capture": {
    "capture_session_id": "isaac-pedregal-20260823-031147Z",
    "captured_at_utc": "2026-08-23T03:11:48+00:00",
    "captured_at_local": "2026-08-23T03:11:48+00:00",
    "capture_timezone": "FILE_MTIME_UTC_TECHNICAL_METADATA",
    "operator": "UNKNOWN_NOT_PROVIDED",
    "reviewer": null,
    "original_filename": "III.png",
    "mime_type": "image/png",
    "file_size_bytes": 324407,
    "width_px": 1276,
    "height_px": 850,
    "sha256": "272368e9707dd3bf4f44f6aa7650fb027676b19605e82f0be3331fbfc289d76b"
  },
  "observation": {
    "displayed_timestamp_raw": "01/04/2026 19:00:00",
    "displayed_timezone": null,
    "metric_label_raw": "Resaltado",
    "value_raw": "0,30",
    "value_numeric": 0.3,
    "unit": "mm",
    "unit_evidence": {
      "source": "AXIS",
      "detail": "Eje vertical visible: Precipitación [mm]."
    },
    "period": "horario",
    "period_evidence": {
      "source": "CHART_TITLE",
      "detail": "Título visible: Datos históricos de precipitación horaria."
    },
    "exact_window_semantics": null,
    "aggregation_scope": "serie resaltada de estación seleccionada"
  },
  "quality": {
    "displayed_qc_flag": null,
    "qc_evidence": null,
    "missing_data_indicator": null,
    "completeness": "PARTIAL",
    "ambiguities": [
      "El timestamp de captura proviene de FILE_MTIME UTC del archivo y no de una declaración del operador; captured_at_local se rellena con ese mismo instante UTC únicamente porque el schema v0.1 exige el campo.",
      "No se proporcionó identidad de operador; el literal UNKNOWN_NOT_PROVIDED satisface una limitación del schema v0.1 y no constituye identidad inferida.",
      "El tooltip muestra simultáneamente Promedio de Precip = 0,43 y Resaltado = 0,30; ninguno se acepta como observación científica.",
      "La zona horaria del timestamp ISAAC no es visible.",
      "La semántica exacta de la ventana horaria no es visible.",
      "La cabecera del tablero muestra actualización 02/06/2026 07:00 PM, por lo que la captura no demuestra una señal fresca de agosto de 2026.",
      "No se registró en esta sesión la disponibilidad de Exportar datos."
    ]
  }
}
